Artist,Album,Date,Score,Genre
JOHN FRUSCIANTE,PBX FUNICIULAR INTAGLIO ZONE,10/16/2012,2,"['RECORD COLLECTION', '2012', 'EXPERIMENTAL ROCK, ART POP, LO-FI, BREAKBEAT ELECTRONICA, DRUM AND BASS']"
DAPHNI,JIAOLONG,10/19/2012,6,"['2012', 'MERGE RECORDS', 'TECH HOUSE, TRIBAL HOUSE']"
BETWEEN THE BURIED AND ME,THE PARALLAX II: FUTURE SEQUENCE,10/19/2012,4,"['2012', 'METAL BLADE', 'PROGRESSIVE METAL, PROGRESSIVE ROCK, METALCORE']"
BLU & EXILE,GIVE ME MY FLOWERS WHILE I CAN STILL SMELL THEM,10/20/2012,7,"['2012', 'DIRTY SCIENCE', 'WEST COAST HIP HOP, BOOM BAP, CONSCIOUS HIP HOP']"
KENDRICK LAMAR,"GOOD KID, M.A.A.D. CITY",10/22/2012,9,"['2012', 'INTERSCOPE', 'WEST COAST HIP HOP, CONSCIOUS HIP HOP']"
KARRIEM RIGGINS,ALONE TOGETHER,10/23/2012,8,"['2012', 'STONESTHROW', 'INSTRUMENTAL HIP HOP, JAZZ, BEATMUSIC']"
3:33,IN THE MIDDLE OF INFINITY,10/24/2012,6,"['PARALLEL THOUGHT', '2012', 'BEATMUSIC', 'INSTRUMENTAL HIP HOP', 'DARK AMBIENT', 'DRONE']"
PIG DESTROYER,BOOK BURNER,10/24/2012,6,"['RELAPSE', '2012', 'GRINDCORE, MOSH RIFFS AND MOSH RIFFS AND MOSH RIFFS']"
CHELSEA WOLFE,UNKNOWN ROOMS: A COLLECTION OF ACOUSTIC SONGS,10/26/2012,7,"['2012', 'SERGEANT HOUSE', 'NEOFOLK, ALTERNATIVE SINGER-SONGWRITER, ETHEREAL WAVE']"
HOAX,3RD EP,10/26/2012,6,"['2012', 'PAINKILLER', 'HARDCORE PUNK']"
ANDY STOTT,LUXURY PROBLEMS,10/29/2012,7,"['2012', 'MODERN LOVE', 'DUB TECHNO, MINIMAL TECHNO, AMBIENT TECHNO, THERE ARE ELEMENTS OF DRONE SPATTERED THROUGHOUT THIS ALBUM, TOO...']"
MAC DEMARCO,2,10/30/2012,6,"['CAPTURED TRACKS', '2012', 'INDIE POP, INDIE ROCK, LO-FI, JANGLE POP']"
THE BAD PLUS,MADE POSSIBLE,10/31/2012,8,"['2012', 'EONE MUSIC', 'JAZZ FUSION, AVANT-GARDE JAZZ, JAZZ']"
THE SOFT MOON,ZEROS,11/1/2012,4,"['CAPTURED TRACKS', '2012', 'GOTHIC ROCK, POST-PUNK, SYNTH PUNK, COLD WAVE']"
BLACK MOTH SUPER RAINBOW,COBRA JUICY,11/1/2012,5,"['2012', 'RAD CULT', 'NEO-PSYCHEDELIA, INDIE ELECTRONIC']"
PILE,DRIPPING,11/2/2012,8,"['2012', 'EXPLODING IN SOUND RECORDS', 'POST-HARDCORE, INDIE ROCK']"
NEUROSIS,HONOR FOUND IN DECAY,11/5/2012,7,"['2012', 'NEUROT', 'ATMOSPHERIC SLUDGE METAL, POST ROCK, A BIT OF FOLK INFLUENCE AS WELL']"
TITUS ANDRONICUS,LOCAL BUSINESS,11/7/2012,6,"['2012', 'XL', 'INDIE ROCK, PUNK, FOLK PUNK, POP PUNK, THE BOSS']"
BAT FOR LASHES,THE HAUNTED MAN,11/8/2012,7,"['2012', 'PARLOPHONE', 'ART POP, SYNTH POP, INDIE POP, DREAM POP, CHAMBER POP']"
THE SECRET,AGNUS DEI,11/8/2012,5,"['SOUTHERN LORD', '2012', 'HARDCORE PUNK, CRUST PUNK, SLUDGE METAL, METALCORE, BLACK METAL']"
BRIAN ENO,LUX,11/12/2012,6,"['WARP', '2012', 'AMBIENT, ELECTRONIC']"
CRYSTAL CASTLES,III,11/13/2012,4,"['2012', 'FICTION & CASABLANCA & UNIVERSAL REBPUBLIC', 'ELECTRONIC, ELECTROPOP, DREAM POP, DARKENED DANCEPOP']"
JESSICA PRATT,SELF-TITLED,11/14/2012,7,"['BIRTH RECORDS', '2012', 'SINGER-SONGWRITER, CONTEMPORARY FOLK']"
DEFTONES,KOI NO YOKAN,11/15/2012,6,"['REPRISE', '2012', 'ALTERNATIVE METAL, SHOEGAZE, ALTERNATIVE ROCK']"
RATKING,WIKI93,11/15/2012,5,"['2012', 'XL RECORDINGS', 'ALTERNATIVE HIP HOP, HARDCORE HIP HOP']"
ACTION BRONSON AND THE ALCHEMIST ,RARE CHEANDELIERS,11/16/2012,8,"['VICE', '2012', 'HARDCORE HIP HOP, EAST COAST HIP HOP']"
VESSEL,ORDER OF NOISE,11/16/2012,7,"['2012', 'TRIANGLE RECORDS', 'MINIMAL TECHNO, DUB, IDM, AMBIENT']"
VESSEL,ORDER OF NOISE,11/16/2012,7,"['2012', 'TRIANGLE RECORDS', 'MINIMAL TECHNO, DUB, IDM, AMBIENT']"
GOAT,WORLD MUSIC,11/19/2012,5,"['ROCKET', '2012', 'PSYCHEDELIC ROCK, AFROBEAT, GARAGE ROCK']"
HOLLY HERNDON,MOVEMENT,11/20/2012,7,"['RVNG INTL.', '2012', 'EXPERIMENTAL, TECHNO, HOUSE']"
CAPTAIN MURPHY,DUALITY,11/21/2012,7,"['2012', 'SELF-RELEASED', 'EXPERIMENTAL HIP HOP']"
THE EVENS,THE ODDS,11/22/2012,8,"['2012', 'DISCHORD RECORDS', 'INDIE, FOLK PUNK, ""D.C. SOUND"", POST-POST-HARDCORE']"
TIM HECKER AND DANIEL LOPATIN,INSTRUMENTAL TOURIST,11/25/2012,5,"['2012', 'SOFTWARE', 'AMBIENT, DRONE, EXPERIMENTAL, EAI, NOISE, GLITCH, PROGRESSIVE ELECTRONIC']"
ANGEL OLSEN,HALF WAY HOME,11/27/2012,7,"['2012', 'BATHETIC', 'SINGER-SONGWRITER, INDIE FOLK, CONTEMPORARY FOLK, ALT-COUNTRY']"
MACINTOSH PLUS,FLORAL SHOPPE,11/28/2012,4,"['2012', 'BEER ON THE RUG', 'PLUNDERPHONICS, EXPERIMENTAL, AMBIENT, SYNTH FUNK, CHOPPED & SCREWED']"
HEEMS,WILD WATER KINGDOM,11/29/2012,5,"['2012', 'GREEDHEAD', 'EAST COAST HIP HOP, ABSTRACT HIP HOP, CLOUD RAP, WATER RAP']"
CODE ORANGE KIDS,LOVE IS LOVE,11/30/2012,6,"['', 'RETURN TO DUST', 'DEATHWISH INC.', '2012', 'SLUDGE METAL, HARDCORE PUNK']"
WU,BLOCK- SELF-TITLED,12/1/2012,6,"['2012', 'EONE', 'EAST COAST HIP HOP, HARDCORE HIP HOP, GANGSTA RAP']"
SCOTT WALKER,BISH BOSCH,12/4/2012,7,"['2012', '4AD', 'EXPERIMENTAL ROCK, SINGER-SONGWRITER, DARK AMBIENT, WEIRDMEOUTSTUFF']"
DRAGGED INTO SUNLIGHT,WIDOWMAKER,12/5/2012,6,"['2012', ""PROSTHETIC RECORDS, SLUDGE METAL, DOOM METAL, DEATH METAL, DEATH DOOM METAL, MAYBE THERE'S SOME BLACK METAL IN THERE AS WELL""]"
ROOMFUL OF TEETH,SELF-TITLED,12/6/2012,7,"['2012', 'NEW AMSTERDAM RECORDS', 'EXPERIMENTAL CHORAL MUSIC, TUVAN THROAT SINGING, A CAPELLA, CLASSICAL']"
P.O.S,WE DON'T EVEN LIVE HERE,12/7/2012,5,"['2012', 'RHYMESAYERS', 'CONSCIOUS HIP HOP,']"
MIGUEL,KALEIDOSCOPE DREAM,12/10/2012,6,"['2012', 'RCA', 'CONTEMPORARY R&B']"
BIG BOI,VICIOUS LIES AND DANGEROUS RUMORS,12/17/2012,5,"['2012', 'DEF JAM', 'SOUTHERN HIP HOP, POP RAP']"
BIG BOI,VICIOUS LIES AND DANGEROUS RUMORS,12/17/2012,5,"['2012', 'DEF JAM', 'SOUTHERN HIP HOP, POP RAP']"
THE GAME,JESUS PIECE,12/18/2012,5,"['2012', 'INTERSCOPE', 'WEST COAST HIP HOP, HARDCORE HIP HOP, GANGSTA RAP, POP RAP']"
THE GAME,JESUS PIECE,12/18/2012,5,"['2012', 'INTERSCOPE', 'WEST COAST HIP HOP, HARDCORE HIP HOP, GANGSTA RAP, POP RAP']"
CHIEF KEEF,FINALLY RICH,12/19/2012,4,"['2012', 'INTERSCOPE', 'TRAP RAP']"
BURIAL,TRUANT,12/20/2012,8,"['ROUGH SLEEPER', 'HYPERDUB', '2012', 'FUTURE GARAGE, DUBSTEP, 2-STEP']"
LIANNE LA HAVAS ,IS YOUR LOVE BIG ENOUGH?,12/22/2012,7," 2012 / WARNER UNITED KINGDOM / NEO-SOUL, POP SOUL, CONTEMPORARY FOLK"
MILO,THINGS THAT HAPPEN AT DAY & THINGS THAT HAPPEN AT NIGHT,1/7/2013,8,"['2013', 'HELLYRE CLUB', 'ABSTRACT HIP HOP, EXPERIMENTAL HIP HOP, CLOUD RAP, SPOKEN WORD']"
A$AP ROCKY ,LONG.LIVE.A$AP,1/8/2013,7,"['RCA', '2013', 'EAST COAST HIP HOP, SOUTHERN HIP HOP, CLOUD RAP, POP RAP']"
CIRCLE TAKES THE SQUARE ,DECOMPOSITIONS: VOLUME NUMBER ONE,1/10/2013,6,"['2013', 'GATEPOST RECORDINGS', 'SLUGE-ESQUE SCREAMO, POST-HARDCORE']"
THE PROGRESSIVE ERA ,PEEP: THE APROCALYPSE,1/11/2013,8,"['2013', 'SELF-RELEASED', 'HARDCORE HIP HOP, EAST COAST HIP HOP, JAZZ RAP']"
TORO Y MOI ,ANYTHING IN RETURN,1/14/2013,4,"['CARPARK', '2013', 'SYNTH FUNK, SYNTH POP, DANCE POP']"
YO LA TENGO ,FADE,1/15/2013,7,"['MATADOR', '2013', 'INDIE ROCK, DREAM POP, PSYCHEDELIC ROCK, KRAUTROCK, JANGLE POP']"
FOXYGEN ,WE ARE THE 21ST CENTURY AMBASSADORS OF PEACE & MAGIC,1/16/2013,8,"['JAGJAGUWAR', '2013', 'GLAM ROCK, INDIE POP, PSYCHEDELIC POP, GARAGE POP, FOLK ROCK, ROCKABILLY']"
VILLAGERS ,{AWAYLAND},1/17/2013,7,"['2013', 'DOMINO', '']"
CULT OF LUNA ,VERTIKAL,1/21/2013,5,"['2013', 'INDIE', 'ATMOSPHERIC SLUDGE METAL, POST-HARDCORE, POST-ROCK, POST-METAL']"
NOSAJ THING ,HOME,1/22/2013,5,"['2013', 'INNOVATIVE LEISURE', 'AMBIENT POP, FUTURE GARAGE, WONKY']"
THIS TOWN NEEDS GUNS ,13.0.0.0.0,1/23/2013,7,"['SARGENT HOUSE', '2013', 'MATH ROCK, INDIE ROCK, EMO']"
COMADRE ,SELF-TITLED,1/24/2013,8,"['2013', ""BAND'S MERCH"", 'HARDCORE PUNK, SCREAMO']"
BUKE AND GASE ,GENERAL DOME,1/25/2013,8,"['2013', 'BRASSLAND', 'NOISE POP, INDIE ROCK, EXPERIMENTAL FOLK']"
LOCAL NATIVES ,HUMMINGBIRD,1/28/2013,5,"['2013', 'FRENCHKISS', 'INDIE ROCK, CHAMBER POP, INDIE FOLK']"
CALIFORNIA X ,SELF-TITLED,1/30/2013,6,"['2013', 'DON GIOVANNI', 'INDIE ROCK, ALTERNATIVE ROCK, NOISE ROCK, STONER ROCK (SLIGHTLY)']"
TOMAHAWK ,ODDFELLOWS,1/31/2013,6,"['2013', 'IPECAC', 'EXPERIMENTAL ROCK, ALTERNATIVE ROCK, MR. BUNGLE VIBES, PATTON-CORE']"
TEGAN AND SARA ,HEARTTHROB,2/4/2013,3,"['2013', 'WARNER BROS.', 'SYNTH POP, ELECTRO POP, TOP-40 MAGIC']"
CAKES DA KILLA ,THE EULOGY,2/5/2013,8,"['2013', 'MISHKA', '']"
DUMBO GETS MAD ,BAD PANDA RECORDS,2/6/2013,6,"['2013', '']"
UNKNOWN MORTAL ORCHESTRA ,II,2/7/2013,7,"['2013', 'JAGJAGUWAR', 'NEO-PSYCHEDELIA, LO-FI, PSYCH POP, POPPY FUNKY GOODTIMES']"
MY BLOODY VALENTINE ,MBV,2/7/2013,8,"['2013', 'SELF-RELEASED', 'SHOEGAZE, DREAM POP, EXPERIMENTAL ROCK, NOISE POP, NEO-PSYCHEDELIA']"
ADAM GREEN & BINKI SHAPIRO ,SELF-TITLED,2/9/2013,6,"['2013', 'ROUNDER RECORDS', 'BAROQUE POP, TWEE POP, CUTESY SLACKER DUETS']"
THE UNDERACHIEVERS ,INDIGOISM,2/11/2013,7,"['2013', 'BRAINFEEDER', 'CONSCIOUS HIP HOP, HARDCORE HIP HOP, ABSTRACT HIP HOP, CLOUD RAP']"
VERONICA FALLS ,WAITING FOR SOMETHING TO HAPPEN,2/13/2013,6,"['2013', 'SLUMBERLAND RECORDS', 'JANGLE POP, TWEE POP']"
FOALS ,HOLY FIRE,2/14/2013,5,"['2013', 'WARNER UNITED KINGDOM', 'INDIE ROCK, DREAM POP, DANCE ROCK, POST-PUNK, SLIGHTLY POST-ROCK-ISH MOMENT']"
PISSED JEANS ,HONEYS,2/15/2013,7,"['2013', 'SUB POP', 'NOISE ROCK, POST-HARDCORE, HARDCORE PUNK']"
GROUPER ,THE MAN WHO DIED IN HIS BOAT,2/16/2013,7,"['2013', 'KRANKY', 'DRONE, AMBIENT, DREAM POP, SINGER-SONGWRITER, LO-FI, PSYCHEDELIC FOLK']"
PORTAL ,VEXOVOID,2/19/2013,5,"['PROFOUND LORE', '2013', 'DEATH METAL, TECHNICAL DEATH METAL, NOISE METAL, BLACK METAL']"
BEACH FOSSILS ,CLASH THE TRUTH,2/20/2013,8,"['CAPTURED TRACKS', '2013', 'JANGLE POP, INDIE ROCK, DREAM POP, INDIE POP, BEACH GUITAR MAGIC, A LITTLE BIT OF POST-PUNK HERE AND THERE, KINDA SHOEGAZE']"
NICK CAVE AND THE BAD SEEDS ,PUSH THE SKY AWAY,2/21/2013,5,"['2013', 'BAD SEED', 'SINGER-SONGWRITER, ART ROCK, CHAMBER POP,']"
ICEAGE ,YOU'RE NOTHING,2/22/2013,8,"['2013', 'MATADOR', 'HARDCORE PUNK, POST-PUNK, NOISE ROCK']"
ATOMS FOR PEACE ,AMOK,2/26/2013,7,"['2013', 'XL', 'GLITCH POP, IDM, EXPERIMENTAL POP, EXPERIMENTAL ROCK, ELECTRONIC THOM YORKE MAGIC']"
CLIPPING ,MIDCITY,2/27/2013,8,"['SELF-RELEASED', '2013', 'HARSH NOISE HYPHY HOP']"
GRAVE BABIES ,CRUSHER,2/27/2013,7,"['2013', 'HARDLY ART', 'SHOEGAZE, NOISE POP, NOISE ROCK, POST-PUNK, GOTH ROCK']"
STRFKR ,MIRACLE MILE,2/28/2013,3,"['2013', 'POLYVINYL', 'INDIE POP, SYNTH POP, DANCE POP, PSYCH POP']"
DARKTHRONE ,THE UNDERGROUND RESISTANCE,3/1/2013,6,"['2013', 'PEACEVILLE', 'HEAVY METAL, SPEED METAL']"
CZARFACE ,SELF-TITLED,3/4/2013,6,"['BRICK', '2013', 'EAST COAST HIP HOP, BOOM BAP']"
STEVEN WILSON ,THE RAVEN THAT REFUSED TO SING (AND OTHER STORIES),3/5/2013,5,"['2013', 'KSCOPE', 'PROGRESSIVE ROCK']"
SHLOHMO ,LAID OUT,3/5/2013,8,"['2013', 'FRIENDS OF FRIENDS', 'TRAP, CONTEMPORARY R&B, ALTERNATIVE R&B, SAD TRAP ELECTRONICA MAGIC, WITCH HOUSE']"
THE MEN ,NEW MOON,3/6/2013,4,"['SACRED BONES', '2013', 'ALT-COUNTRY, GARAGE ROCK, PSYCH ROCK, INDIE ROCK, KINDA SORTA FOLK ROCK WITH AN ATTITUDE']"
AUTECHRE ,EXAI,3/7/2013,8,"['WARP', '2013', 'IDM, GLITCH, EXPERIMENTAL, IRREGULAR TECHNO MAGIC, SONIC SORCERY, DRUM \'N\' GLITCH, AMBIENT, ""RECKS ON"" HAS A BIT OF A HIP HOP FLAVOR TO IT, TOO.']"
RHYE ,WOMAN,3/19/2013,6,"['2013', 'POLYDOR', 'SOPHISTI-POP, INDIE POP, JAZZ POP, CONTEMPORARY R&B, SOUL']"
NAILS ,ABANDON ALL LIFE,3/20/2013,7,"['SOUTHERN LORD', '2013', 'POWERVIOLENCE, HARDCORE PUNK, GRINDCORE']"
THE STROKES ,COMEDOWN MACHINE,3/21/2013,5,"['2013', 'RCA RECORDS', 'POP ROCK, GARAGE ROCK, NEW WAVE, INDIE ROCK, DISCO INDIE SYNTH STUFF WITH FALSETTO VOCALS']"
DOPE BODY ,SATURDAY,3/21/2013,7,"['DRAG CITY', '2013', 'SLUDGE METAL, PSYCH ROCK, HARDCORE PUNK, PARTY COCK ROCK CORE']"
DAVID BOWIE ,THE NEXT DAY,3/23/2013,7,"['COLUMBIA', '2013', 'ART ROCK, GLAM ROCK, POP ROCK']"
JUSTIN TIMBERLAKE ,THE 20,3/25/2013,20,"['20 EXPERIENCE', '2013', 'RCA RECORDS', 'DANCE POP, CONTEMPORARY R&B, NEO-SOUL, POP']"
KEN MODE ,ENTRENCH,3/26/2013,7,"['SEASON OF MIST', '2013', 'POST-HARDCORE, NOISE ROCK, SLUDGE METAL']"
THE DRONES ,I SEE SEAWEED,3/27/2013,8,"['2013', 'SELF-RELEASED, I THINK', 'GARAGE ROCK, INDIE ROCK, PSYCH ROCK, NOISE ROCK, EXPERIMENTAL ROCK, SINGER-SONGWRITER']"
BONOBO ,THE NORTH BORDERS,3/27/2013,6,"['NINJA TUNE', '2013', 'DOWNTEMPO, FUTURE GARAGE, NU JAZZ']"
KVELERTAK ,MEIR,3/28/2013,8,"['ROADRUNNER', '2013', ""HARDCORE PUNK, HEAVY METAL, ROCK 'N' ROLL, BLACK METAL""]"
LAPALUX ,NOSTALCHIC,3/29/2013,7,"['2013', 'BRAINFEEDER', 'WONKY, FUTURE GARAGE, CONTEMPORARY R&B, PSYCHEDELIC BEAT MAGIC']"
WAVVES ,AFRAID OF HEIGHTS,4/1/2013,6,"['2013', 'MOM + POP', 'POP PUNK, GARAGE ROCK, ALTERNATIVE ROCK, GRUNGE']"
"TYLER, THE CREATOR ",WOLF,4/2/2013,6,"['2013', 'SELF-RELEASED', 'WEST COAST HIP HOP, JAZZ RAP, WEST COAST HIP HOP']"
THE MARY ONETTES ,HIT THE WAVES,4/3/2013,7,"['2013', 'LABRADOR', 'SYNTH POP, DREAM POP, JANGLE POP, 80S NOSTALGIA POP, HAVE YOU EVER HEARD OF THIS BAND CALLED ""THE CURE""?']"
THE BLACK HEART REBELLION ,HAR NEVO,4/4/2013,7,"['2013', 'SMOKE & DUST RECORDS', 'PSYCH ROCK, FOLK, POST-METAL, DRONE, EXPERIMENTAL ROCK, POST-ROCK']"
THE KNIFE ,SHAKING THE HABITUAL,4/7/2013,9,"['2013', 'MUTE', 'ELECTRONIC, EXPERIMENTAL, TECHNO, ART POP, TECH HOUSE, DARK AMBIENT']"
THE FLAMING LIPS ,THE TERROR,4/11/2013,6,"['2013', 'WARNER BROS.', 'NEO-PSYCHEDELIA, EXPERIMENTAL ROCK, DREAM POP, AMBIENT POP, KRAUT ROCK, SPACE ROCK']"
THEE OH SEES ,FLOATING COFFIN,4/17/2013,5,"['2013', 'CASTLE FACE', 'GARAGE ROCK, LO-FI, GARAGE PUNK, PSYCHEDELIC ROCK, NOISE ROCK']"
PHOSPHORESCENT ,MUCHACHO,4/18/2013,6,"['2013', 'DEAD OCEANS', 'AMERICANA, ALT-COUNTRY, FOLK, NEO FOLK']"
KURT VILE ,WAKING ON A PRETTY DAZE,4/19/2013,8,"['2013', 'MATADOR', 'FOLK ROCK, PSYCHEDELIC FOLK, INDIE FOLK, DREAM FOLK MAGIC, CLOUD FOLK']"
KID CUDI ,INDICUD,4/20/2013,2,"['G.O.O.D. MUSIC', '2013', 'POP RAP, ABSTRACT HIP HOP']"
GHOSTFACE KILLAH AND ANDRIAN YOUNGE ,12 REASONS TO DIE,4/22/2013,8,"['SOUL TEMPLE', '2013', 'EAST COAST HIP HOP, HARDCORE HIP HOP, SOUNDTRACK']"
YEAH YEAH YEAHS ,MOSQUITO,4/23/2013,5,"['2013', 'POLYDOR', 'INDIE ROCK, GARAGE ROCK, ART ROCK, NEO-PSYCHEDELIA']"
DEERHUNTER ,MONOMANIA,4/24/2013,6,"['2013', '4AD', 'NOISE ROCK, NOISE POP, PSYCHEDELIC ROCK, NEO-PSYCHEDELIA, GARAGE ROCK']"
COLIN STETSON ,NEW HISTORY WARFARE VOL. 3: TO SEE MORE LIGHT,4/26/2013,7,"['2013', 'CONSTELLATION', 'EXPERIMENTAL, AVANT-GARDE JAZZ, POST-MINIMALISM']"
IGGY AND THE STOOGES ,READY TO DIE,4/28/2013,4,"['2013', 'FAT POSSUM', ""GARAGE ROCK, HARD ROCK, PUNK ROCK, ROCK 'N' ROLL""]"
JENNY HVAL ,INNOCENCE IS KINKY,4/30/2013,7,"['2013', 'RUNE GRAMMOFON', 'ART POP, CHAMBER POP, SINGER-SONGWRITER, SPOKEN WORD']"
THE HAXAN CLOAK ,EXCAVATION,5/1/2013,8,"['2013', 'TRI ANGLE RECORDS', 'DARK AMBIENT, AMBIENT DUB, DRONE']"
SAVAGES ,SILENCE YOURSELF,5/2/2013,8,"['2013', 'MATADOR', 'POST-PUNK, GOTHIC ROCK, PUNK ROCK, NOISE ROCK']"
R.A. THE RUGGED MAN ,LEGENDS NEVER DIE,5/4/2013,6,"['NATURE SOUNDS', '2013', 'EAST COAST HIP HOP, HARDCORE HIP HOP']"
CHANCE THE RAPPER ,ACID RAP,5/7/2013,6,"['2013', 'SELF-RELEASED', 'POP RAP, JAZZ RAP, JUKE']"
ALTAR OF PLAGUES , TEETHED GLORY AND INJURY,5/7/2013,9,[]
LITTLE WOMEN ,LUNG,5/8/2013,6,"['AUM FIDELITY', '2013', 'AVANT-GARDE JAZZ, NOISE ROCK, MATH ROCK']"
PHOENIX ,BANKRUPT!,5/9/2013,5,"['2013', 'GLASSNOTE', 'INDIE POP, SYNTH POP, INDIE ROCK, NEW WAVE']"
THE UNCLUDED ,HOKEY FRIGHT,5/10/2013,7,"['2013', 'RHYMESAYERS ENTERTAINMENT', 'ABSTRACT HIP HOP, ANTI-FOLK, FOLK HOP, EXPERIMENTAL HIP HOP, SINGER-SONGWRITER HIP HOP FUSION MAGIC']"
CHARLI XCX ,TRUE ROMANCE,5/13/2013,3,"['2013', 'ASYLUM', 'ELECTROPOP, SYNTH POP, DANCE POP']"
VAMPIRE WEEKEND ,MODERN VAMPIRES OF THE CITY,5/14/2013,7,"['2013', 'XL', 'INDIE ROCK, INDIE POP, BAROQUE POP, CHAMBER POP']"
CO LA ,MOODY COUP,5/14/2013,6,"['SOFTWARE RECORDING CO.', '2013', 'PLUNDERPHONICS, WONKY TECHNO, GLITCH, VAPORWAVE, DISORIENTING SAMPLES']"
THE DILLINGER ESCAPE PLAN ,ONE OF US IS THE KILLER,5/16/2013,8,"['SUMERIAN RECORDS', '2013', 'MATHCORE, METALCORE, SPAZZCORE, POST-HARDCORE, RIFF MANIA, ALTERNATIVE METAL']"
DAFT PUNK ,RANDOM ACCESS MEMORIES,5/20/2013,8,"['2013', 'DISCO, SYNTH FUNK, SMOOTH FUNK, AOR, SOFT ROCK, PROGRESSIVE SYNTH, ELECTRO-DISCO']"
DAFT PUNK ,RANDOM ACCESS MEMORIES,5/20/2013,8,"['2013', 'DISCO, SYNTH FUNK, SMOOTH FUNK, AOR, SOFT ROCK, PROGRESSIVE SYNTH, ELECTRO-DISCO']"
THE NATIONAL ,TROUBLE WILL FIND ME,5/21/2013,4,"['2013', '4AD', 'CHAMBER POP, INDIE ROCK']"
ANAMANAGUCHI ,ENDLESS FANTASY,5/22/2013,6,"['2013', 'SELF-RELEASED', 'CHIPTUNE, POWER POP, HOUSE, ELECTROPOP']"
THIS ROUTINE IS HELL ,HOWL,5/23/2013,8,"['2013', 'COBRA RECORDS, SHIELD RECORDINGS, RUINS RECORDS', 'PUNK ROCK, HARDCORE PUNK, SLUDGE PUNK']"
CLASSIXX ,HANGING GARDENS,5/24/2013,6,"['2013', 'INNOVATIVE LEISURE', 'HOUSE, SYNTH POP, SYNTH FUNK']"
TRAVIS SCOTT ,OWL PHARAOH,5/27/2013,3,"['2013', 'EPIC, GRAND HUSTLE', 'TRAP RAP, POP RAP, SOUTHERN HIP HOP']"
THE WORLD IS A BEAUTIFUL PLACE AND I AM NO LONGER AFRAID TO DIE ,"WHENEVER, IF EVER",5/28/2013,7,"['2013', 'TOPSHELF RECORDS', 'EMO, MIDWEST EMO, INDIE ROCK']"
BATHS ,OBSIDIAN,5/29/2013,6,"['ANTICON.', '2013', 'GLITCH POP, CHAMBER POP, SYNTH POP, INDIE ELECTRONIC']"
QUASIMOTO ,YESSIRWHATEVER,5/30/2013,7,"['2013', 'STONES THROW', 'ABSTRACT HIP HOP, BOOM BAP, JAZZ RAP, PSYCH RAP']"
BIBIO ,SILVER WILKINSON,5/31/2013,7,"['2013', 'WARP', 'FOLKTRONICA, GLITCH POP, DREAM POP, DREAM FOLK, INSTRUMENTAL HIP HOP,']"
DEAFHEAVEN ,SUNBATHER,5/31/2013,8,"['DEATHWISH INC.', '2013', 'ATMOSPHERIC BLACK METAL, POST-ROCK, BLACKGAZE, AMBIENT, SCREAMO']"
QUEENS OF THE STONE AGE ,...LIKE CLOCKWORK,6/4/2013,9,"['2013', 'MATADOR RECORDS', 'ALTERNATIVE ROCK, STONER ROCK']"
CX KIDTRONIK ,KRAK ATTACK 2: THE BALLAD OF ELLI SKIFF,6/5/2013,6,"['2013', 'STONES THROW', 'EXPERIMENTAL HIP HOP, INDUSTRIAL HIP HOP, DIGITAL HARDCORE, DRUM MACHINE METAL THAT RIPS YOUR FACE OFF']"
DISCLOSURE ,SETTLE,6/5/2013,7,"['2013', 'ISLAND RECORDS', 'UK GARAGE, FUTURE GARAGE, HOUSE, DEEP HOUSE,']"
DISCLOSURE ,SETTLE,6/5/2013,7,"['2013', 'ISLAND RECORDS', 'UK GARAGE, FUTURE GARAGE, HOUSE, DEEP HOUSE,']"
LAURA MARLING ,ONCE I WAS AN EAGLE,6/7/2013,7,"['RIBBON', '2013', 'SINGER-SONGWRITER, CONTEMPORARY FOLK']"
THUNDERCAT ,APOCALYPSE,6/10/2013,3,"['2013', 'BRAINFEEDER', 'JAZZ FUSION, NU JAZZ, JAZZ-FUNK, CONTEMPORARY R&B']"
BOARDS OF CANADA ,TOMORROW'S HARVEST,6/12/2013,6,"['2013', 'WARP', 'AMBIENT, IDM, PROGRESSIVE SYNTH, PROGRESSIVE ELECTRONIC, DOWNTEMPO, AMBIENT TECHNO']"
YOUNG FATHERS ,TAPE TWO,6/13/2013,8,"['2013', 'ANTICON.', 'EXPERIMENTAL HIP HOP, ABSTRACT HIP HOP, AFRICAN HIP HOP LO-FI NOISE FUSION, POST-HIP HOP, AVANT-NEO-SOUL']"
YOUNG FATHERS ,TAPE TWO,6/13/2013,8,"['2013', 'ANTICON.', 'EXPERIMENTAL HIP HOP, ABSTRACT HIP HOP, AFRICAN HIP HOP LO-FI NOISE FUSION, POST-HIP HOP, AVANT-NEO-SOUL']"
MR. MUTHAFUCKIN' EXQUIRE ,KISMET,6/15/2013,7,"['2013', 'SELF-RELEASED', 'HARDCORE HIP HOP, EAST COAST HIP HOP, BOOM BAP,']"
JON HOPKINS ,IMMUNITY,6/17/2013,8,"['2013', 'DOMINO RECORDS', 'TECH HOUSE, TECHNO, MICRO HOUSE, AMBIENT, GLITCHY DANCE MAGIC, LOFTY POST-HOUSE']"
KANYE WEST ,YEEZUS,6/18/2013,5,"['2013', 'DEF JAM', 'EXPERIMENTAL HIP HOP, INDUSTRIAL HIP HOP, HARDCORE HIP HOP, AUTO-TUNED NOISE HOP. HOUSE HOP']"
MELT YOURSELF DOWN ,SELF-TITLED,6/19/2013,7,"['2013', 'THE LEAF LABEL', 'ALTERNATIVE FUNK JAZZ FUSION, AFROBEAT, ART PUNK, JAZZROCK, MEDITERRANEAN HORN PUNK']"
ZOMBY ,WITH LOVE,6/21/2013,5,"['4AD', '2013', 'UK BASS, TRAP, FUTURE GARAGE, NOCTURNAL BREAKS, MOODY ELECTRONICA ATMOSPHERES']"
MAC MILLER ,WATCHING MOVIES WITH THE SOUND OFF,6/22/2013,6,"['2013', 'ROSTRUM', 'CLOUD RAP, POP RAP, HIP HOP, SWAG RAPSZ, MAC MILLER-CORE, TEXTURE BEATZ']"
J. COLE ,BORN SINNER,6/25/2013,5,"['2013', 'ROC NATION', 'POP RAP, HARDCORE HIP HOP, CONSCIOUS HIP HOP']"
SMITH WESTERNS ,SOFT WILL,6/26/2013,8,"['2013', 'MOM + POP', ""POP ROCK, INDIE POP, JANGLE POP, INDIE ROCK, SWEET SWEETNESS, DREAM POP (SORTA), LITTLE BIT OF PSYCH POP IN THERE, CRYBABY ROCK, PINK FLOYD XEROXES, GEORGE HARRISON WAS QUITE A GUYY'all know this is just my opinion, right?""]"
LOCRIAN ,RETURN TO ANNIHILATION,6/28/2013,6,"['2013', 'RELAPSE RECORDS', 'BLACK METAL, NOISE, EXPERIMENTAL ROCK, DRONE, DARK AMBIENT, POST-ROCK']"
KYARY PAMYU PAMYU ,NANDACOLLECTION,7/1/2013,8,"['2013', 'WARNER MUSIC JAPAN', 'POP, DANCE-POP, ELECTROPOP, ""J-POP""']"
JOEY BADA$$ ,SUMMER KNIGHTS,7/3/2013,7,"['2013', 'SELF-RELEASED', 'EAST COAST HIP HOP, HARDCORE HIP HOP, BEAST COAST MAGIC, JAZZ RAP']"
RUN THE JEWELS ,SELF-TITLED,7/8/2013,8,"[""FOOL'S GOLD"", '2013', 'HARDCORE HIP HOP, ABSTRACT HIP HOP']"
BILLY WOODS ,DOUR CANDY,7/8/2013,7,"['2013', 'BACKWOODZ STUDIOZ', 'HARDCORE HIP HOP, ABSTRACT HIP HOP, GRIMY STORYTELLING, BLOCKHEAD INSTRUMENTAL MAGIC, D.C. ANONYMITY']"
JAY,Z - MAGNA CARTA... HOLY GRAIL,7/9/2013,6,"['2013', 'ROC NATION', 'EAST COAST HIP HOP, POP RAP, TRAP RAP']"
JAMES HOLDEN ,THE INHERITORS,7/10/2013,7,"['2013', 'BORDER COMMUNITY', 'TECHNO, MICROHOUSE, ELECTROACOUSTIC, AMBIENT, PROGRESSIVE SYNTH, IDM']"
AUTOPSY ,THE HEADLESS RITUAL,7/11/2013,6,"['2013', 'PEACEVILLE', 'DEATH METAL, DEATH DOOM METAL, DEATH AND HEAVY METAL FUSIONS']"
MARIAM THE BELIEVER ,BLOOD DONATION,7/15/2013,8,"['2013', 'REPEAT UNTIL DEATH', 'ART POP, SOUL, EXPERIMENTAL ROCK, SINGER-SONGWRITER']"
YUNG LEAN ,UNKNOWN DEATH 2002,7/17/2013,BREAD,"['2013', 'MISHKA', 'BREAD']"
LYCUS ,TEMPEST,7/17/2013,7,"['20 BUCK SPIN', '2013', 'FUNERAL DOOM METAL, DOOM METAL, DEATH METAL GROWL MAGIC, HEAVY AS HELL POWER BALLAD MELODIES']"
LETLIVE. ,THE BLACKEST BEAUTIFUL,7/18/2013,5,"['2013', 'EPITAPH', 'POST-HARDCORE AND POP PUNK HYBRID MAGIC']"
STONE TITAN ,SCRATCH N' SNIFF,7/24/2013,8,"['2013', 'SAFETY MEETING RECORDS', 'SLUDGE METAL, NOISE METAL, EXTREME SLUDGE MAGIC, HEAVY PSYCH, DEADLY SOUNDS']"
FUCK BUTTONS ,SLOW FOCUS,7/25/2013,6,"['2013', 'ATP RECORDINGS', 'ELECTRONIC NEO-PSYCH, DRONE, EXPERIMENTAL INDIE TECHNO']"
EDWARD SHARPE & THE MAGNETIC ZEROS ,SELF-TITLED,7/29/2013,3,"['2013', 'VAGRANT RECORDS', 'INDIE FOLK, INDIE POP, AMERICANA, VINTAGE PSYCHEDELIC POP']"
KA ,THE NIGHT'S GAMBIT,7/31/2013,8,"['2013', 'IRON WORKS RECORDS', 'EAST COAST HIP HOP, MINIMAL HIP HOP, HARDCORE HIP HOP, SUPER QUIET RAPS']"
ALUNAGEORGE ,BODY MUSIC,8/2/2013,7,"['2013', 'ISLAND', 'DANCE-POP, CONTEMPORARY R&B, POP, ELECTROPOP, UK BASS, FUTURE GARAGE']"
CANDY CLAWS ,CERES & CALYPSO IN THE DEEP TIME,8/6/2013,7,"['2013', 'TWO SYLLABLE RECORDS', 'DREAM POP, SHOEGAZE, LO-FI, INDIE POP']"
DEAD IN THE DIRT ,THE BLIND HOLE,8/7/2013,6,"['SOUTHERN LORD', '2013', 'HARDCORE PUNK, POWERVIOLENCE, SLUDGE METAL, CRUST PUNK, GRINDCORE']"
TECH N9NE ,SOMETHING ELSE,8/8/2013,4,"['2013', 'STRANGE MUSIC', 'HARDCORE HIP HOP, POP RAP, RAP METAL']"
MODERN LIFE IS WAR ,FEVER HUTNING,8/12/2013,7,"['DEATHWISH INC.', '2013', 'HARDCORE PUNK, MELODIC HARDCORE']"
TOAD ,ENDLESS NIGHT,8/13/2013,7,"['2013', 'SELF-RELEASED', ""BLACK METAL, SLUDGE METAL, HEAVY METAL, DEATH 'N' ROLL""]"
WASHED OUT ,PARACOSM,8/15/2013,6,"['SUB POP', '2013', 'DREAM POP, NEO-PSYCHEDELIA, CHILLWAVE, SYNTH POP, DREAM REGGAE']"
NO AGE ,AN OBJECT,8/17/2013,6,"['SUB POP', '2013', 'ART PUNK, NOISE ROCK, POST-PUNK, LO-FI ROCK']"
EARL SWEATSHIRT ,DORIS,8/26/2013,6,"['COLUMBIA RECORDS', '2013', 'ALTERNATIVE HIP HOP, ABSTRACT HIP HOP (SORTA), TRAPPED & SCREWED BAP JAZZ RAP AMALGAMATION, WHISPER RAPS']"
JULIA HOLTER ,LOUD CITY SONG,8/26/2013,8,"['2013', 'DOMINO RECORDS', 'DREAM POP, ART POP, CHAMBER POP, PROGRESSIVE POP, EXPERIMENTAL POP, DREAM JAZZ']"
A$AP FERG ,TRAP LORD,8/28/2013,7,"['2013', 'TRAP RAP', 'SOUTHERN HIP HOP', 'MEMPHIS RAPS', 'CLOUD RAP', 'POST-BONE THUGS', 'SWAG RAPS']"
KING KRULE ,6 FEET BENEATH THE MOON,8/29/2013,7,"['2013', 'XL', 'INDIE ROCK, INDIE POP, DREAM POP, REVERB ROCK, VINTAGE RETRO TRIP HOP, SLICK SINGER-SONGWRITER DUDE']"
DAWN OF MIDI ,DYSNOMIA,8/30/2013,5,"['THIRSTY EAR', '2013', 'MINIMALIST GROOVE JAZZ, ELECTROACOUSTIC REPETITION VOODOO']"
GORGUTS ,COLORED SANDS,9/2/2013,8,"['2013', 'SEASON OF MIST', 'TECHNICAL DEATH METAL, PROGRESSIVE DEATH METAL, ATMOSPHERIC SLUDGE METAL, AVANT-GARDE METAL']"
YC THE CYNIC ,GNK,9/3/2013,8,"['2013', 'SELF-RELEASED', 'EAST COAST HIP HOP, CLOUD RAP, CONSCIOUS HIP HOP, ABSTRACT HIP HOP, THOUGHTFUL RAPS, PSYCH RAPS, HEADY WORDPLAY MAGIC']"
HOLOGRAMS ,FOREVER,9/4/2013,6,"['CAPTURED TRACKS', '2013', 'POST-PUNK, SYNTH PUNK']"
JONATHAN RADO ,LAW & ORDER,9/4/2013,4,"['2013', 'WOODSIST', ""PSYCHEDELIC POP, GARAGE ROCK, SYNTH POP, BRIT POP, MOD ROCK, LO-FI ROCK 'N' ROLL""]"
DIZZY WRIGHT ,THE GOLDEN AGE,9/5/2013,5,"['2013', 'FUNK VOLUME', 'POP RAP, TRAP RAP, JAZZ RAP']"
ARCTIC MONKEYS ,AM,9/8/2013,3,"['DOMINO RECORDS', '2013', 'INDIE ROCK, ALTERNATIVE ROCK']"
NINE INCH NAILS ,HESITATION MARKS,9/9/2013,6,"['2013', 'COLUMBIA', 'ELECTRO-INDUSTRIAL, INDUSTRIAL ROCK']"
CHELSEA WOLFE ,PAIN IS BEAUTY,9/10/2013,8,"['2013', '']"
HOLY GHOST! ,DYNAMICS,9/11/2013,7,"['DFA RECORDS', '2013', 'ELECTRO-DISCO, NEW WAVE, NU-DISCO, SYNCH POP']"
FACTORY FLOOR ,SELF-TITLED,9/12/2013,6,"['DFA RECORDS', '2013', 'MINIMAL WAVE, SYNTH PUNK, POST-PUNK, ELECTRONIC, ELECTRO-INDUSTRIAL DANCE PARTY, DANCEFLOOR STRANGENESS']"
JANELLE MONAE ,THE ELECTRIC LADY,9/13/2013,7,"['2013', 'BAD BOY RECORDS', 'CONTEMPORARY R&B, ART POP, BAROQUE POP, POP SOUL, NEO-SOUL, SMOOTH SOUL']"
DENZEL CURRY ,NOSTALGIC 64,9/16/2013,7,"['2013', 'SELF-RELEASED', 'MEMPHIS RAP, SOUTHERN HIP HOP, TRAP RAP, HARDCORE HIP HOP, HORRORCORE (SLIGHTLY)']"
THE WEEKND ,KISS LAND,9/17/2013,5,"['2013', 'REPUBLIC', 'CONTEMPORARY R&B, MOODY AND DEPRESSING R&B']"
CRYSTAL STILTS ,NATURE NOIR,9/18/2013,6,"['2013', 'SACRED BONES', ""PSYCHEDELIC ROCK, GARAGE ROCK, DARK ROCK 'N' ROLL, DEADPAN""]"
MGMT ,SELF-TITLED,9/19/2013,6,"['COLUMBIA', '2013', 'PSYCHEDELIC POP, NEO-PSYCHEDELIA, FUZZYNESS']"
KAYO DOT ,HUBARDO,9/20/2013,7,"['ICE LEVEL', '2013', 'AVANT-GARDE METAL, PROGRESSIVE ROCK, PROGRESSIVE METAL, JAZZ FUSION, CHAMBER MUSIC, DEATH METAL, POST-ROCK, BLACK METAL, SLIGHTLY IMPROVISED NIGHTMARES, EPIC POET STORIES']"
FLATBUSH ZOMBIES ,BETTEROFFDEAD,9/23/2013,8,"['2013', 'SELF-RELEASED', 'HARDCORE HIP HOP, TRAP RAP, CLOUD RAP, PSYCHEDELIC RAP MAGIC, GRIMY NEW YORK SHIZ']"
MACHINEDRUM ,VAPOR CITY,9/23/2013,7,"['NINJA TUNE', '2013', 'FOOTWORK, JUKE, UK BASS, FUTURE GARAGE']"
BILL CALLAHAN ,DREAM RIVER,9/24/2013,8,"['2013', 'DRAG CITY RECORDS', 'AMERICANA, FOLK ROCK, PROGRESSIVE FOLK, INDIE FOLK']"
